{
  "protocolVersion": 1,
  "projectId": "fixture-project",
  "name": "fixture",
  "projectRoot": "/work/tests/fixtures/simple",
  "inputMode": "filelist",
  "filelistPath": "/work/tests/fixtures/simple/design.f",
  "filelistMode": "-f",
  "workingDirectory": "/work/tests/fixtures/simple",
  "topMode": "explicit",
  "topModule": "top",
  "sourceRoots": ["/work/tests/fixtures/simple"],
  "defines": [],
  "includeRoots": [],
  "libraries": [],
  "parameters": [],
  "language": "1800-2017",
  "singleUnit": false,
  "threads": 1,
  "warningAsError": false,
  "warningOptions": [],
  "configRevision": 1,
  "configDigest": "0000000000000000000000000000000000000000000000000000000000000000"
}
